{
  "feature_id": "001-quant-ops-dashboard",
  "phase_id": "phase-4",
  "status": "accepted",
  "summary": "Completed the operator UI and final route-level validation.",
  "canonical_change": false,
  "changed_artifacts": [],
  "accepted_deviations": [
    "Kept admin controls and full analytics expansion outside the current release."
  ],
  "completed_task_ids": [
    "DASH-401",
    "DASH-402",
    "DASH-403"
  ],
  "validation": [
    "The web app built cleanly.",
    "Route-level and operator-journey tests passed.",
    "No page depended on mocked production data."
  ]
}
