{
  "feature_id": "001-quant-ops-dashboard",
  "phase_id": "pre-implement-revision",
  "status": "accepted",
  "summary": "Closed analyze findings and forced both checklist gates into a clean PASS state before coding.",
  "canonical_change": true,
  "changed_artifacts": [
    "spec.md",
    "plan.md",
    "checklists/requirements.md",
    "checklists/quality.md",
    "tasks.json"
  ],
  "accepted_deviations": [
    "Kept the dashboard focused on operator-critical routes before broader analytics."
  ],
  "completed_task_ids": [],
  "validation": [
    "requirements.md was fully PASS.",
    "quality.md was fully PASS.",
    "Analyze no longer reported blocking contradictions."
  ]
}
